,movie_genres,movie_id,movie_title,poster_url,movie_url,description,rating,num_review,director,writer,cast,age_rating,year,movie_length
0,[10 13 16],682,I Know What You Did Last Summer (1997),https://images-na.ssl-images-amazon.com/images/M/MV5BZDI4ODJlNGUtNjFiMy00ODgzLWIzYjgtMzgyZTljZDQ2NGZiXkEyXkFqcGdeQXVyMTQxNzMzNDI@..jpg,http://www.imdb.com/title/tt0119345/?ref_=fn_al_tt_1,Four young friends bound by a tragic accident are reunited when they find themselves being stalked by a hook-wielding maniac in their small seaside town.,5.7,139K,['Jim Gillespie'],"['Lois Duncan', 'Kevin Williamson']","['Jennifer Love Hewitt', 'Sarah Michelle Gellar', 'Anne Heche', 'Ryan Phillippe', 'Freddie Prinze Jr.', 'Muse Watson', 'Bridgette Wilson-Sampras', 'Johnny Galecki', 'Stuart Greer', 'J. Don Ferguson', 'Deborah Hobart', 'Mary McMillan', ""Rasool J'Han"", 'Dan Albright', 'Lynda Clark', 'Shea Broom', 'John Bennes', 'Jennifer Bland']",R,1997,1h 41min
1,[1 3],768,Casper (1995),https://images-na.ssl-images-amazon.com/images/M/MV5BZThhYTlhMDUtMDhjZi00MTljLTkwMDYtOGU3ZjVlMWE4NDk4XkEyXkFqcGdeQXVyMTQxNzMzNDI@..jpg,http://www.imdb.com/title/tt0112642/?ref_=fn_al_tt_1,An afterlife therapist and his daughter meet a friendly young ghost when they move into a crumbling mansion in order to rid the premises of wicked spirits.,6.1,127K,['Brad Silberling'],"['Joseph Oriolo', 'Sherri Stoner', 'Deanna Oliver']","['Bill Pullman', 'Christina Ricci', 'Cathy Moriarty', 'Eric Idle', 'Chauncey Leopardi', 'Spencer Vrooman', 'Malachi Pearson', 'Ben Stein', 'Don Novello', 'Fred Rogers', 'Terry Murphy', 'Ernestine Mercer', 'Doug Bruckner', 'Joe Nipote', 'Joe Alaskey', 'Brad Garrett', 'John Kassir', 'Garette Ratliff Henson']",PG,1995,1h 40min
2,[ 9 16],1422,Suture (1993),https://images-na.ssl-images-amazon.com/images/M/MV5BOTc0ODlkMzEtNjE5My00ODA2LTg5ZjMtYWFjOTE1ZmNmMzk0XkEyXkFqcGdeQXVyMTQxNzMzNDI@..jpg,http://www.imdb.com/title/tt0108260/?ref_=fn_al_tt_1,"After his brother tries to kill him, a man survives only to find himself in another man's body.",6.6,1.9K,"['Scott McGehee', 'David Siegel']","['Scott McGehee', 'David Siegel']","['Dennis Haysbert', 'Mel Harris', 'Sab Shimono', 'Dina Merrill', 'Michael Harris', 'David Graf', 'Fran Ryan', 'John Ingle', 'Sanford Gibbons', 'Mark DeMichele', 'Sandra Ellis Lafferty', 'Capri Darling', 'Carol Kiernan', 'Laura Groppe', 'Mel Coleman', 'Lon Carli', 'Ann Van Wey', 'Sam Smiley']",Not Rated,1993,1h 36min
3,[7],454,Bastard Out of Carolina (1996),https://images-na.ssl-images-amazon.com/images/M/MV5BMjA5MDkyMzU1N15BMl5BanBnXkFtZTcwMTk5NzMyMQ@@..jpg,http://www.imdb.com/title/tt0115633/?ref_=fn_al_tt_1,A mother and daughter find their lives adversely affected when a new man enters the picture. Will their family ever be what they expect?,7.4,4.3K,['Anjelica Huston'],"['Dorothy Allison', 'Anne Meredith']","['Jennifer Jason Leigh', 'Ron Eldard', 'Glenne Headly', 'Lyle Lovett', 'Jena Malone', 'Dermot Mulroney', 'Christina Ricci', 'Michael Rooker', 'Diana Scarwid', 'Susan Traylor', 'Grace Zabriskie', 'Richard Todd Sullivan', 'Pat Hingle', 'Lindley Mayer', 'Jamison Stewart', 'Timothy Stewart', 'Kelsey Elizabeth Boulware', 'Jeffrey Pillars']",R,1996,1h 38min
4,[ 0  1 16],930,Chain Reaction (1996),https://images-na.ssl-images-amazon.com/images/M/MV5BZTkzZmQxZmQtZmJkMS00YmJlLWI0YmItMjcwYzBhM2E3NGQzXkEyXkFqcGdeQXVyNjU0OTQ0OTY@..jpg,http://www.imdb.com/title/tt0115857/?ref_=fn_al_tt_1,Two researchers in a green alternative energy project are put on the run when they are framed for murder and treason.,5.7,51K,['Andrew Davis'],"['Arne Schmidt', 'Rick Seaman', 'Josh Friedman']","['Keanu Reeves', 'Morgan Freeman', 'Rachel Weisz', 'Fred Ward', 'Kevin Dunn', 'Brian Cox', 'Joanna Cassidy', 'Chelcie Ross', 'Nicholas Rudall', 'Tzi Ma', 'Krzysztof Pieczynski', 'Julie Pearl', 'Godfrey', 'Gene Barge', 'Nathan Davis', 'Aaron Williams', 'Daniel H. Friedman', 'Johnny Lee Davenport']",PG-13,1996,1h 47min
5,[7],1224,"Scout, The (1994)",https://images-na.ssl-images-amazon.com/images/M/MV5BYTllMzNmNzItN2IzNC00YjhmLThiMmItY2RmODBiMGE2NjMxXkEyXkFqcGdeQXVyMTQxNzMzNDI@..jpg,http://www.imdb.com/title/tt0111094/?ref_=fn_al_tt_1,The story of a baseball scout who discovers a talented but troubled baseball player.,5.4,6.3K,['Michael Ritchie'],"['Roger Angell', 'Andrew Bergman', 'Albert Brooks']","['Albert Brooks', 'Brendan Fraser', 'Dianne Wiest', 'Anne Twomey', 'Lane Smith', 'Michael Rapaport', 'Barry Shabaka Henley', 'John Capodice', 'Art Garfield', 'Louis Giovannetti', 'Stephen Demek', 'Ralph Drischell', 'Brett Rickaby', 'Jack Rader', 'Marcia Rodd', 'Steve Eastin', 'Lee Weaver', 'John LaMotta']",PG-13,1994,1h 41min
6,[19],621,"Davy Crockett, King of the Wild Frontier (1955)",https://images-na.ssl-images-amazon.com/images/M/MV5BZWY3MGVmM2YtYzkzYy00MjNmLTljMDctNDc5ZWUyNTM2OWU0XkEyXkFqcGdeQXVyMDUyOTUyNQ@@..jpg,http://www.imdb.com/title/tt0047977/?ref_=fn_al_tt_1,"American frontiersman Davy Crockett fights in the Creek Indian War, is elected to the U.S. Congress and fights for Texas at the Alamo.",7.0,4K,['Norman Foster'],['Thomas W. Blackburn'],"['Fess Parker', 'Buddy Ebsen', 'Basil Ruysdael', 'Hans Conried', 'William Bakewell', 'Kenneth Tobey', 'Pat Hogan', 'Helene Stanley', 'Nick Cravat', 'Don Megowan', 'Mike Mazurki', 'Jeff Thompson', 'Henry Joyner', 'Campbell Brown', 'Robert Booth', 'Eugene Brindel', 'Benjamin Hornbuckle', 'Jim Maddux']",Approved,1955,1h 33min
7,[ 0  4 18],80,Hot Shots! Part Deux (1993),https://images-na.ssl-images-amazon.com/images/M/MV5BZjU2ODlmZWMtODEwZS00NTQ0LTk1ZDYtYzk0ZjE3ZGZhMGM0XkEyXkFqcGdeQXVyMTQxNzMzNDI@..jpg,http://www.imdb.com/title/tt0107144/?ref_=fn_al_tt_1,"""Rambo"" parody in which Topper Harley leads a rescue team into Iraq to save Iraqi war prisoners and all of their previous rescue teams.",6.6,88K,['Jim Abrahams'],"['Jim Abrahams', 'Pat Proft']","['Charlie Sheen', 'Lloyd Bridges', 'Valeria Golino', 'Richard Crenna', 'Brenda Bakke', 'Miguel Ferrer', 'Rowan Atkinson', 'Jerry Haleva', 'David Wohl', 'Mitchell Ryan', 'Michael Colyar', 'Ryan Stiles', 'Rosemary Johnston', 'Ben Lemon', 'Buck McDancer', 'Larry Lindsey', 'Ed Beheler', 'Daniel T. Healy']",PG-13,1993,1h 26min
8,[ 4 16],1670,Tainted (1998),https://images-na.ssl-images-amazon.com/images/M/MV5BMjA3ODk4MzM2MF5BMl5BanBnXkFtZTgwMzE4MDU1NjE@..jpg,http://www.imdb.com/title/tt0128690/?ref_=fn_al_tt_1,A sarcastic comedy thriller about a vampire who sets out to infect the blood of a hospital and the twenty-something slackers who set out to stop him.,4.3,126,['Brian Evans'],['Sean Farley'],"['Jason Brouwer', 'T.J. Timon', 'Ronnie Walsh', 'Greg James', 'Stacey Murphy', 'Trish Stroh', 'Tuyen Cao', 'Kevin Joy', 'Sean Farley', 'Dean Chekvala', 'Carol Thoel', 'Edward Zeimis', 'Kristy Thoel', 'Robert St. Mary', 'Benedetto Sorrentino', 'Scott Clevenger', 'Tina Kapousis', 'Micheal Agrusso']",R,1998,1h 48min
9,[7],676,"Crucible, The (1996)",https://images-na.ssl-images-amazon.com/images/M/MV5BN2ZhOTQ5NGUtNDJiYy00ZTM5LWI5MDItNDI3OGZhYzlhZDRhXkEyXkFqcGdeQXVyNjUwNzk3NDc@..jpg,http://www.imdb.com/title/tt0115988/?ref_=fn_al_tt_1,A Salem resident attempts to frame her ex-lover's wife for being a witch in the middle of the 1692 witchcraft trials.,6.8,37K,['Nicholas Hytner'],['Arthur Miller'],"['Daniel Day-Lewis', 'Winona Ryder', 'Paul Scofield', 'Joan Allen', 'Bruce Davison', 'Rob Campbell', 'Jeffrey Jones', 'Peter Vaughan', 'Karron Graves', 'Charlayne Woodard', 'Frances Conroy', 'Elizabeth Lawrence', 'George Gaynes', 'Mary Pat Gleason', 'Robert Breuler', 'Rachael Bella', 'Ashley Peldon', 'Tom McDermott']",PG-13,1996,2h 4min
10,[0],1372,"Stranger, The (1994)",https://images-na.ssl-images-amazon.com/images/M/MV5BMTk1MDI3MDAxMl5BMl5BanBnXkFtZTcwMjk0NzAzMQ@@..jpg,http://www.imdb.com/title/tt0110809/?ref_=fn_al_tt_1,Robert Urich as a lawyer in love with a woman who's married to a dying millionaire.,6.1,587,['Michael Miller'],"['Danielle Steel', 'Jan Worthington']","['Robert Urich', 'Stacy Haiduk', 'Darren McGavin', 'Susan Sullivan', 'Holly Marie Combs', 'Marion Ross', 'Ron Gabriel', 'Tamara Gorski', 'George R. Robertson', 'Patricia Brown', 'Denise McLeod', 'Margaret Ozols', 'Adrian Truss', 'Natalie Gray', 'Michal Page']",,,
11,[ 7 14],714,Carrington (1995),https://images-na.ssl-images-amazon.com/images/M/MV5BZjQ3MTBkNDEtMGRlZS00OTY0LTkzYjktOWU2MzI3ZDRiMjY5XkEyXkFqcGdeQXVyMTA0MjU0Ng@@..jpg,http://www.imdb.com/title/tt0112637/?ref_=fn_al_tt_1,The platonic relationship between artist Dora Carrington (Dame Emma Thompson) and writer Lytton Strachey (Jonathan Pryce) in the early twentieth century.,6.8,5.4K,['Christopher Hampton'],"['Christopher Hampton', 'Michael Holroyd']","['Emma Thompson', 'Jonathan Pryce', 'Steven Waddington', 'Samuel West', 'Rufus Sewell', 'Penelope Wilton', 'Janet McTeer', 'Peter Blythe', 'Jeremy Northam', 'Alex Kingston', 'Sebastian Harcombe', 'Richard Clifford', 'David Ryall', 'Stephen Boxer', 'Annabel Mullion', 'Gary Turner', 'Georgiana Dacombe', 'Helen Blatch']",R,1995,2h 1min
12,[16],1073,Shallow Grave (1994),https://images-na.ssl-images-amazon.com/images/M/MV5BZmVmOWVlODYtOTQ0Yy00ODY1LTgwZjMtYWFhOWQ3ODhmYjliL2ltYWdlXkEyXkFqcGdeQXVyNjUwNzk3NDc@..jpg,http://www.imdb.com/title/tt0111149/?ref_=fn_al_tt_1,Three friends discover their new flatmate dead but loaded with cash.,7.3,59K,['Danny Boyle'],['John Hodge'],"['Kerry Fox', 'Christopher Eccleston', 'Ewan McGregor', 'Ken Stott', 'Keith Allen', 'Colin McCredie', 'Victoria Nairn', 'Gary Lewis', 'Jean Marie Coffey', 'Peter Mullan', ""Leonard O'Malley"", 'David Scoular', 'Grant Glendinning', 'Victor Eadie', 'Robert David MacDonald', 'Frances Low', 'Bill Denistoun', 'John Bett']",R,1994,1h 29min
13,[ 7 14],1119,Some Kind of Wonderful (1987),https://images-na.ssl-images-amazon.com/images/M/MV5BMzM5ODExMjc5MV5BMl5BanBnXkFtZTgwODc3MjEyMDE@..jpg,http://www.imdb.com/title/tt0094006/?ref_=fn_al_tt_1,"When Keith goes out with Amanda, the girl of his dreams, Amanda's ex-boyfriend plans to get back at Keith. Meanwhile, Keith's best friend, tomboy Watts, realizes she has feelings for Keith.",7.1,30K,['Howard Deutch'],['John Hughes'],"['Eric Stoltz', 'Mary Stuart Masterson', 'Lea Thompson', 'Craig Sheffer', 'John Ashton', 'Elias Koteas', 'Molly Hagan', 'Maddie Corman', 'Jane Elliot', 'Candace Cameron Bure', 'Chynna Phillips', 'Scott Coffey', 'Carmine Caridi', 'Lee Garlington', 'Laura Leigh Hughes', 'Laura Tubelle', 'Amy Lynne', 'Michael Bergman']",PG-13,1987,1h 35min
14,[7],1538,All Over Me (1997),https://images-na.ssl-images-amazon.com/images/M/MV5BMTU4MzY4NzI0M15BMl5BanBnXkFtZTcwMjQ0MDY5Mg@@..jpg,http://www.imdb.com/title/tt0118586/?ref_=fn_al_tt_1,"Claude and Ellen are best friends who live in a not-so-nice area of New York. They're involved in the subculture of 90s youth, complete with drugs, live music, and homophobia. All is changed one night when a violent and meaningless death rocks their lives.",6.4,3.3K,['Alex Sichel'],['Sylvia Sichel'],"['Alison Folland', 'Tara Subkoff', 'Cole Hauser', 'Wilson Cruz', 'Leisha Hailey', 'Pat Briggs', 'Ann Dowd', 'Gene Canfield', 'Shawn Hatosy', 'Vincent Pastore', 'David Lee Russek', 'Aaron Harpold', 'John Ottavino', 'A. Russell Andrews', 'Gary Lucas', 'Mary Timony', 'Vanessa Godson', 'Jennifer Smith']",R,1997,1h 26min
15,[4],1461,Here Comes Cookie (1935),https://images-na.ssl-images-amazon.com/images/M/MV5BMjAyNDQ4NTg0NF5BMl5BanBnXkFtZTcwODM4OTQxMQ@@..jpg,http://www.imdb.com/title/tt0026465/?ref_=fn_al_tt_1,"Alarmed that his younger daughter is about to marry a gold-digger, a millionaire turns over the fortune to her ditsy older sister for safe-keeping to his ultimate regret, protection.",6.3,161,['Norman Z. McLeod'],"['Don Hartman', 'Sam Mintz']","['George Burns', 'Gracie Allen', 'George Barbier', 'Betty Furness', 'Andrew Tombes', 'Rafael Alcayde', 'James Burke', 'Lee Kohlmar', 'Milla Davenport', 'Harry Holman', 'Frank Darien', 'Jack Powell', 'Irving Bacon', ""Guinn 'Big Boy' Williams"", 'Nick Moro', 'Frank Yaconelli', 'The Six Olympics', 'The Buccaneers']",Approved,1935,1h 5min
16,[ 4 18],211,M*A*S*H (1970),https://images-na.ssl-images-amazon.com/images/M/MV5BMTc4NjE4MzI0N15BMl5BanBnXkFtZTgwMzIwMTM0MDE@..jpg,http://www.imdb.com/title/tt0066026/?ref_=fn_al_tt_1,The staff of a Korean War field hospital use humor and high jinks to keep their sanity in the face of the horror of war.,7.5,70K,['Robert Altman'],"['Richard Hooker', 'Ring Lardner Jr.']","['Donald Sutherland', 'Elliott Gould', 'Tom Skerritt', 'Sally Kellerman', 'Robert Duvall', 'Roger Bowen', 'Rene Auberjonois', 'David Arkin', 'Jo Ann Pflug', 'Gary Burghoff', 'Fred Williamson', 'Michael Murphy', 'Indus Arthur', 'Ken Prymus', 'Bobby Troup', 'Kim Atwood', 'Timothy Brown', 'John Schuck']",R,1970,1h 56min
17,[ 2 15],1240,Ghost in the Shell (Kokaku kidotai) (1995),https://images-na.ssl-images-amazon.com/images/M/MV5BM2FhYzVkMzQtOTVlYS00NTYxLThjNzktMDVhNjU1MDE0ZTc5L2ltYWdlL2ltYWdlXkEyXkFqcGdeQXVyNTAyODkwOQ@@..jpg,http://www.imdb.com/title/tt0113568/?ref_=fn_al_tt_1,A cyborg policewoman and her partner hunt a mysterious and powerful hacker called the Puppet Master.,8.0,136K,['Mamoru Oshii'],"['Shirow Masamune', 'Kazunori Itô']","['Atsuko Tanaka', 'Iemasa Kayumi', 'Akio Ôtsuka', 'Kôichi Yamadera', 'Yutaka Nakano', 'Tamio Ôki', 'Tesshô Genda', 'Namaki Masakazu', 'Masato Yamanouchi', 'Shinji Ogawa', 'Mitsuru Miyamoto', 'Kazuhiro Yamaji', 'Shigeru Chiba', 'Hiroshi Yanaka', 'Ginzô Matsuo', 'Takashi Matsuyama', 'Sanryô Odaka', 'Masamichi Satô']",TV-MA,1995,1h 23min
18,[ 4 13],805,Manhattan Murder Mystery (1993),https://images-na.ssl-images-amazon.com/images/M/MV5BMWM5MGZiZDAtMWE0Ny00MjY3LWJlOWItNjY4MmI4NDAyM2NhXkEyXkFqcGdeQXVyNDk3NzU2MTQ@..jpg,http://www.imdb.com/title/tt0107507/?ref_=fn_al_tt_1,A middle-aged couple suspects foul play when their neighbor's wife suddenly drops dead.,7.3,42K,['Woody Allen'],"['Woody Allen', 'Marshall Brickman']","['Woody Allen', 'Diane Keaton', 'Jerry Adler', 'Lynn Cohen', 'Ron Rifkin', 'Joy Behar', 'William Addy', 'John Doumanian', 'Sylvia Kauders', 'Ira Wheeler', 'Alan Alda', 'Anjelica Huston', 'Melanie Norris', 'Marge Redmond', 'Zach Braff', 'George J. Manos', 'Linda Taylor', 'Aida Turturro']",PG,1993,1h 44min
19,[ 0 15 16],1596,Nemesis 2: Nebula (1995),https://images-na.ssl-images-amazon.com/images/M/MV5BZGViNmRkYzQtOTFlOC00NjY2LThhMDYtNzc0YzI3MWMwMDBiXkEyXkFqcGdeQXVyNjExODE1MDc@..jpg,http://www.imdb.com/title/tt0113948/?ref_=fn_al_tt_1,"It has been 73 years since Alex failed and the Humans lost the Cyborg Wars. Since then, the Humans have been enslaved. Scientists have developed a new DNA strain, which could signal the end of the Cyborgs, and they inject it into a volunteer. When the Cyborgs learn of the woman and the baby they list both for termination. To escape, she takes a stolen Cyborg ship and transports back in time to East Africa in 1980, where the mother is killed, but the baby is saved. It takes 20 years, but the Cyborg bounty hunter Nebula finally locates the girl, named Alex, and travels back in time to terminate her.",3.8,1.8K,['Albert Pyun'],"['Rebecca Charles', 'Albert Pyun']","['Sue Price', 'Chad Stahelski', 'Tina Cote', 'Earl White', 'Jahi J.J. Zuri', 'Karen Studer', 'Shelton Baily', 'Donya Dinnah', 'Jon H. Epstein', 'Sharon Bruneau', 'Debbie Muggli', 'Zachary Studer', 'Dave Fisher', 'Bob Brown', 'Cinque Glendy', 'Richard Cetrone', 'Michael Banks', 'Tracy Davis']",,,
20,[7],1447,Century (1993),https://images-na.ssl-images-amazon.com/images/M/MV5BMTM1ODYwNzI1OF5BMl5BanBnXkFtZTcwNjMxODcxMQ@@..jpg,http://www.imdb.com/title/tt0106537/?ref_=fn_al_tt_1,"Paul Reisner, a young doctor, becomes a researcher in a prestigious medical institute. He feels he has a chance to be part of a movement of unending progress in science and civilization. Then he begins to discover the dark side of the institute, which foreshadows the dark side of the 20th century.",6.1,330,['Stephen Poliakoff'],['Stephen Poliakoff'],"['Charles Dance', 'Clive Owen', 'Miranda Richardson', 'Robert Stephens', 'Joan Hickson', 'Lena Headey', 'Neil Stuke', 'Liza Walker', 'Joseph Bennett', 'Fiona Walker', 'Carlton Chance', 'Graham Loughridge', 'Lex Daniel', 'Ian Shaw', 'Bruce Alexander', 'Mark Strong', 'Dail Sullivan', 'Mark Hadfield']",R,1993,1h 52min
21,[7],1619,All Things Fair (1996),https://images-na.ssl-images-amazon.com/images/M/MV5BNDY0ZDRmYTItYjZiYi00MTAyLTkxNWMtZTQxMWIyNzcyMzk2XkEyXkFqcGdeQXVyMTMwOTMzNzU@..jpg,http://www.imdb.com/title/tt0113720/?ref_=fn_al_tt_1,"Malmö, Sweden during the Second World War. Stig is a 15 year old pupil on the verge of adulthood. Viola is 37 years old and his teacher. He is attracted by her beauty and maturity. She is drawn to him by his youth and innocence. At the same time, Stig becomes friends with Viola's husband Kjell, who teaches him classical music, and the affair continues even after he understands that he has a relationship with his wife. but does nothing to prevent it. But Stig and Viola's passionate and forbidden relationship will have consequences they never could have expected.",6.9,6.2K,['Bo Widerberg'],['Bo Widerberg'],"['Johan Widerberg', 'Marika Lagercrantz', 'Tomas von Brömssen', 'Karin Huldt', 'Nina Gunke', 'Kenneth Milldoff', 'Björn Kjellman', 'Frida Lindholm', 'Sigge Cederlund', 'Monica Stenbeck', 'Gösta Ekstrand', 'Hilda Suovanen', 'Per Olov Börjeson', 'Jörgen Svensson', 'George Bisset', 'Nynne Schwartz', 'Magnus Andersson', 'Paul Lindsjö']",Unrated,1995,2h 10min
22,[6],115,"Haunted World of Edward D. Wood Jr., The (1995)",https://images-na.ssl-images-amazon.com/images/M/MV5BMTMxMDcyNjQ4N15BMl5BanBnXkFtZTcwMTI2NjcyMQ@@..jpg,http://www.imdb.com/title/tt0113270/?ref_=fn_al_tt_1,How was it possible that a movie like Plan 9 from Outer Space (1957) could be made? This documentary about Edward D. Wood Jr.'s masterpiece gives the answer.,7.3,447,['Brett Thompson'],['Brett Thompson'],"['Maila Nurmi', 'Dolores Fuller', 'Paul Marco', 'Conrad Brooks', 'Loretta King', 'Lynn Lemon', 'Bela Lugosi', 'Bela Lugosi Jr.', 'Norma McCarty', 'Michael McCarthy', 'Mona McKinnon', 'Joseph F. Robertson', 'Lyle Talbot', 'Harry Thomas', 'Crawford John Thomas', 'Gregory Walcott', 'David Ward', 'Edward D. Wood Jr.']",Not Rated,1995,1h 29min
23,[7],1008,I Shot Andy Warhol (1996),https://images-na.ssl-images-amazon.com/images/M/MV5BNWJkZTI3ZGUtOWQ3Ni00Y2Y5LTgxYWEtODQ4Yjg4M2ZmMWQ3L2ltYWdlL2ltYWdlXkEyXkFqcGdeQXVyMTA0MjU0Ng@@..jpg,http://www.imdb.com/title/tt0116594/?ref_=fn_al_tt_1,"This is the story of Valerie Solanas who was a 60s radical preaching hatred toward men in her ""Scum"" manifesto. She wrote a screenplay for a film that she wanted Andy Warhol to produce. After many times of ignoring her, Valerie shot him.",6.6,6.6K,['Mary Harron'],"['Jeremiah Newton', 'Diane Tucker', 'Mary Harron']","['Lili Taylor', 'Jared Harris', 'Martha Plimpton', 'Lothaire Bluteau', 'Anna Thomson', 'Peter Friedman', 'Tahnee Welch', 'Jamie Harrold', 'Donovan Leitch Jr.', 'Michael Imperioli', 'Reg Rogers', 'Bill Sage', 'Jill Hennessy', 'Coco McPherson', 'Myriam Cyr', 'Danny Morgenstern', 'Lola Pashalinski', 'Lynn Cohen']",R,1996,1h 43min
24,[ 4 14],111,"Truth About Cats & Dogs, The (1996)",https://images-na.ssl-images-amazon.com/images/M/MV5BOWM0MTA4NjItMzM3ZS00NDJmLTg3NWItNGE5ODIyOGJhNzQ0L2ltYWdlL2ltYWdlXkEyXkFqcGdeQXVyMTQxNzMzNDI@..jpg,http://www.imdb.com/title/tt0117979/?ref_=fn_al_tt_1,A successful veternarian & radio show host with low self-esteem asks her model friend to impersonate her when a handsome man wants to see her.,6.3,27K,['Michael Lehmann'],['Audrey Wells'],"['Uma Thurman', 'Janeane Garofalo', 'Ben Chaplin', 'Jamie Foxx', 'James McCaffrey', 'Richard Coca', 'Stanley DeSantis', 'Antoinette Valente', 'Mitch Rouse', 'La Tanya M. Fisher', 'Faryn Einhorn', 'David Cross', 'Mary Lynn Rajskub', 'Bob Odenkirk', 'Dechen Thurman', 'Victoria Edwards', 'Lisa Marie Russell', 'Robert Brinkmann']",PG-13,1996,1h 37min
25,[4],1007,Waiting for Guffman (1996),https://images-na.ssl-images-amazon.com/images/M/MV5BMTY5ODAzMDA4NF5BMl5BanBnXkFtZTcwNjc0MTkxMQ@@..jpg,http://www.imdb.com/title/tt0118111/?ref_=fn_al_tt_1,An aspiring director and the marginally talented amateur cast of a hokey small-town Missouri musical production go overboard when they learn that someone from Broadway will be in attendance.,7.5,28K,['Christopher Guest'],"['Christopher Guest', 'Eugene Levy']","['Christopher Guest', 'Fred Willard', ""Catherine O'Hara"", 'Parker Posey', 'Deborah Theaker', 'Michael Hitchcock', 'Scott Williamson', 'Larry Miller', 'Don Lake', 'David Cross', 'Eugene Levy', 'James McQueen', 'Turk Pipkin', 'Jerry Turman', 'Bob Balaban', 'Paul Dooley', 'Linda Kash', 'Lewis Arquette']",R,1996,1h 24min
26,[0],1222,Judgment Night (1993),https://images-na.ssl-images-amazon.com/images/M/MV5BMTI1NjIzMDIyN15BMl5BanBnXkFtZTcwNjIzNDQyMQ@@..jpg,http://www.imdb.com/title/tt0107286/?ref_=fn_al_tt_1,"Four young friends, while taking a shortcut en route to a local boxing match, witness a brutal murder which leaves them running for their lives.",6.6,16K,['Stephen Hopkins'],"['Lewis Colick', 'Jere Cunningham']","['Emilio Estevez', 'Cuba Gooding Jr.', 'Denis Leary', 'Stephen Dorff', 'Jeremy Piven', 'Peter Greene', 'Erik Schrody', 'Michael Wiseman', 'Michael DeLorenzo', 'Relioues Webb', 'Will Zahrn', 'Eugene Williams', 'Christine Harnos', 'Galyn Görg', 'Angela Alvarado', 'Lauren Robinson', 'Doug Wert', 'Raichle Watt']",R,1993,1h 50min
27,[ 4 18],1185,In the Army Now (1994),https://images-na.ssl-images-amazon.com/images/M/MV5BOWU5MDMzODQtMmM0ZS00MjU5LWExMzMtZjBlOTczY2NjNTMzXkEyXkFqcGdeQXVyMjY3MjUzNDk@..jpg,http://www.imdb.com/title/tt0110123/?ref_=fn_al_tt_1,Two misguided youths join the reserves to make some money for their entrepreneurial dreams. No sooner than they finish basic training are they called up to do their part to save the free world.,5.0,13K,['Daniel Petrie Jr.'],"['Steve Zacharias', 'Jeff Buhai', 'Robbie Fox']","['Pauly Shore', 'Lori Petty', 'Andy Dick', 'David Alan Grier', 'Esai Morales', 'Lynn Whitfield', 'Art LaFleur', 'Fabiana Udenio', 'Glenn Morshower', 'Beau Billingslea', 'Peter Spellos', 'Barry Nolan', 'Coleen Christie', 'Ryan Cutrona', 'Paul Mooney', 'Richard Assad', 'Allen R. Stokes', 'Earl M. Nicholson']",PG,1994,1h 31min
28,[4 7],1631,"Slingshot, The (1993)",https://images-na.ssl-images-amazon.com/images/M/MV5BMTI4OTM2Njg1MV5BMl5BanBnXkFtZTYwODAyNzg5..jpg,http://www.imdb.com/title/tt0107349/?ref_=fn_al_tt_1,"Stocholm in the 1920s. Young Roland lives with his socialist father, Jewish mother and a boxing brother. His mother sells condoms illegally, and from them, Roland makes slingshots which he sells. His rebellious ways has gotten him the special attention of his school teacher, who always makes sure that Roland is punished. Roland also tries to make extra money by repairing bicycles, a successful business that in the end lands him in hot water.",6.4,2K,['Åke Sandgren'],"['Åke Sandgren', 'Roland Schütt']","['Jesper Salén', 'Stellan Skarsgård', 'Basia Frydman', 'Niklas Olund', 'Ernst-Hugo Järegård', 'Ernst Günther', 'Axel Düberg', 'Reine Brynolfsson', 'Heinz Hopf', 'Frida Hallgren', 'Tomas Norström', 'Ing-Marie Carlsson', 'Rolf Lassgård', 'Jurek Sawka', 'Tommy Johnson', 'Per Sandberg', 'Margreth Weivers', 'Rolf Eberg']",R,1993,1h 42min
29,[ 4 14],1072,"Pyromaniac's Love Story, A (1995)",https://images-na.ssl-images-amazon.com/images/M/MV5BZjlkYTg1NTgtZDJiMC00ODZlLTkwMDktYTU2ODVkNTkzODA1XkEyXkFqcGdeQXVyNzc5MjA3OA@@..jpg,http://www.imdb.com/title/tt0114210/?ref_=fn_al_tt_1,"A pastry boy and the son of a hair-piece mogul become involved in an arson scandal. Sergio (John Leguizamo) is offered a bribe in exchange for taking the blame for the fire that destroyed his workplace. Garet (William Baldwin), the real arsonist, is apalled that someone else would try to take credit for his act of love. Before long, Sergio and Garet become entangled in a zany love-quadrangle involving Hattie (Sadie Frost) and Stephanie (Erika Eleniak).",5.3,1.1K,['Joshua Brand'],['Morgan Ward'],"['William Baldwin', 'John Leguizamo', 'Sadie Frost', 'Erika Eleniak', 'Michael Lerner', 'Joan Plowright', 'Armin Mueller-Stahl', 'Mike Starr', 'Julio Oscar Mechoso', 'Floyd Vivino', 'Babs Chula', 'Tony Perri', 'Randy Butcher', 'Lesley Kelly', 'Jennifer Rolin', 'Elena Kudaba', 'Michael McCullough', 'Derrick Patterson']",PG,1995,1h 34min
30,[7],867,"Whole Wide World, The (1996)",https://images-na.ssl-images-amazon.com/images/M/MV5BMTFkZmQ5OWEtNjFmMC00ZTI2LWE0ZWUtN2VhOWE1MzdiOGJhXkEyXkFqcGdeQXVyMTQ4NDY5OTc@..jpg,http://www.imdb.com/title/tt6173150/?ref_=fn_al_tt_1,"It looks like we don't have any Plot Summaries for this title yet.
Be the first to contribute! Just click the ""Edit page"" button at the bottom of the page or learn more in the Plot Summary submission guide.",,,"['Roger Ebert', 'Gene Siskel']","['', '']","['Roger Ebert', 'Gene Siskel']",,,
31,[1 3],1503,Gold Diggers: The Secret of Bear Mountain (1995),https://images-na.ssl-images-amazon.com/images/M/MV5BMDhkYTk3Y2ItNTdiZS00NTIwLTgwNTMtODVmMmIwMjMwZGYxXkEyXkFqcGdeQXVyNjgzMjI4ODE@..jpg,http://www.imdb.com/title/tt0113188/?ref_=fn_al_tt_1,"A city girl teams up with a tomboy to solve the mystery of Bear Mountain, Molly Morgan, and the buried treasure as well as learn about true friendships.",6.0,4.4K,['Kevin James Dobson'],['Barry Glasser'],"['Christina Ricci', 'Anna Chlumsky', 'Polly Draper', 'Brian Kerwin', 'Diana Scarwid', 'David Keith', 'Gillian Barber', 'Ashleigh Aston Moore', 'Jewel Staite', 'Amy Kirk', 'Dwight McFee', 'Andrew Wheeler', 'Roger Cross', 'Kimberley Warnat', 'Jesse Moss', 'Scott Augustine', 'Steve Makaj', 'Betty Phillips']",PG,1995,1h 33min
